city,zone,code,areas,name,party
連江縣,連江縣第01選區,09007-01,南竿鄉,,
連江縣,連江縣第02選區,09007-02,北竿鄉,,
連江縣,連江縣第03選區,09007-03,莒光鄉,,
連江縣,連江縣第04選區,09007-04,東引鄉,,
金門縣,金門縣第01選區,09020-01,金城鎮/金寧鄉/烏坵鄉,,
金門縣,金門縣第02選區,09020-02,金沙鎮/金湖鎮,,
金門縣,金門縣第03選區,09020-03,烈嶼鄉,,
宜蘭縣,宜蘭縣第01選區,10002-01,宜蘭市,,
宜蘭縣,宜蘭縣第02選區,10002-02,頭城鎮,,
宜蘭縣,宜蘭縣第03選區,10002-03,礁溪鄉,,
宜蘭縣,宜蘭縣第04選區,10002-04,員山鄉,,
宜蘭縣,宜蘭縣第05選區,10002-05,壯圍鄉,,
宜蘭縣,宜蘭縣第06選區,10002-06,羅東鎮,,
宜蘭縣,宜蘭縣第07選區,10002-07,五結鄉,,
宜蘭縣,宜蘭縣第08選區,10002-08,冬山鄉,,
宜蘭縣,宜蘭縣第09選區,10002-09,三星鄉/大同鄉,,
宜蘭縣,宜蘭縣第10選區,10002-10,蘇澳鎮/南澳鄉,,
新竹縣,新竹縣第01選區,10004-01,竹北市,,
新竹縣,新竹縣第02選區,10004-02,湖口鄉,,
新竹縣,新竹縣第03選區,10004-03,新豐鄉,,
新竹縣,新竹縣第04選區,10004-04,關西鎮,,
新竹縣,新竹縣第05選區,10004-05,新埔鎮,,
新竹縣,新竹縣第06選區,10004-06,橫山鄉/尖石鄉,,
新竹縣,新竹縣第07選區,10004-07,芎林鄉,,
新竹縣,新竹縣第08選區,10004-08,竹東鎮/五峰鄉,,
新竹縣,新竹縣第09選區,10004-09,寶山鄉,,
新竹縣,新竹縣第10選區,10004-10,北埔鄉/峨眉鄉,,
苗栗縣,苗栗縣第01選區,10005-01,苗栗市/公館鄉/頭屋鄉,,
苗栗縣,苗栗縣第02選區,10005-02,銅鑼鄉/三義鄉/西湖鄉,,
苗栗縣,苗栗縣第03選區,10005-03,通霄鎮/苑裡鎮,,
苗栗縣,苗栗縣第04選區,10005-04,竹南鎮/後龍鎮/造橋鄉,,
苗栗縣,苗栗縣第05選區,10005-05,頭份鎮/南庄鄉/三灣鄉,,
苗栗縣,苗栗縣第06選區,10005-06,卓蘭鎮/大湖鄉/獅潭鄉/泰安鄉,,
彰化縣,彰化縣第01選區,10007-01,彰化市/花壇鄉/芬園鄉,,
彰化縣,彰化縣第02選區,10007-02,福興鄉/鹿港鎮/秀水鄉,,
彰化縣,彰化縣第03選區,10007-03,線西鄉/伸港鄉/和美鎮,,
彰化縣,彰化縣第04選區,10007-04,員林鎮/大村鄉/永靖鄉,,
彰化縣,彰化縣第05選區,10007-05,埔鹽鄉/埔心鄉/溪湖鎮,,
彰化縣,彰化縣第06選區,10007-06,田中鎮/社頭鄉/二水鄉,,
彰化縣,彰化縣第07選區,10007-07,北斗鎮/田尾鄉/埤頭鄉/溪州鄉,,
彰化縣,彰化縣第08選區,10007-08,二林鎮/芳苑鄉/大城鄉/竹塘鄉,,
南投縣,南投縣第01選區,10008-01,南投市/名間鄉,,
南投縣,南投縣第02選區,10008-02,草屯鎮/中寮鄉,,
南投縣,南投縣第03選區,10008-03,水里鄉/信義鄉/集集鎮/魚池鄉,,
南投縣,南投縣第04選區,10008-04,竹山鎮/鹿谷鄉,,
南投縣,南投縣第05選區,10008-05,仁愛鄉/埔里鎮/國姓鄉,,
雲林縣,雲林縣第01選區,10009-01,斗六市/莿桐鄉/林內鄉,,
雲林縣,雲林縣第02選區,10009-02,斗南鎮/古坑鄉/大埤鄉,,
雲林縣,雲林縣第03選區,10009-03,虎尾鎮/土庫鎮/褒忠鄉/元長鄉,,
雲林縣,雲林縣第04選區,10009-04,西螺鎮/二崙鄉/崙背鄉,,
雲林縣,雲林縣第05選區,10009-05,麥寮鄉/東勢鄉/臺西鄉/四湖鄉,,
雲林縣,雲林縣第06選區,10009-06,北港鎮/口湖鄉/水林鄉,,
嘉義縣,嘉義縣第01選區,10010-01,太保市/鹿草鄉/水上鄉,,
嘉義縣,嘉義縣第02選區,10010-02,民雄鄉/新港鄉,,
嘉義縣,嘉義縣第03選區,10010-03,大林鎮/溪口鄉/梅山鄉,,
嘉義縣,嘉義縣第04選區,10010-04,朴子市/六腳鄉/東石鄉,,
嘉義縣,嘉義縣第05選區,10010-05,布袋鎮/義竹鄉,,
嘉義縣,嘉義縣第06選區,10010-06,中埔鄉/竹崎鄉/番路鄉/大埔鄉/阿里山鄉,,
屏東縣,屏東縣第01選區,10013-01,屏東市,,
屏東縣,屏東縣第02選區,10013-02,長治鄉/麟洛鄉/九如鄉/里港鄉/鹽埔鄉/高樹鄉/三地門鄉/霧臺鄉/瑪家鄉,,
屏東縣,屏東縣第03選區,10013-03,潮州鎮/內埔鄉/竹田鄉/萬巒鄉/新埤鄉/枋寮鄉/泰武鄉/來義鄉/春日鄉,,
屏東縣,屏東縣第04選區,10013-04,東港鎮/萬丹鄉/新園鄉,,
屏東縣,屏東縣第05選區,10013-05,崁頂鄉/林邊鄉/南州鄉/佳冬鄉,,
屏東縣,屏東縣第06選區,10013-06,恆春鎮/車城鄉/滿州鄉/枋山鄉/獅子鄉/牡丹鄉,,
屏東縣,屏東縣第07選區,10013-07,琉球鄉,,
臺東縣,臺東縣第01選區,10014-01,蘭嶼鄉/臺東市,,
臺東縣,臺東縣第02選區,10014-02,延平鄉/卑南鄉,,
臺東縣,臺東縣第03選區,10014-03,成功鎮/東河鄉/長濱鄉,,
臺東縣,臺東縣第04選區,10014-04,關山鎮/鹿野鄉/池上鄉/海端鄉,,
臺東縣,臺東縣第05選區,10014-05,金峰鄉/達仁鄉/太麻里鄉/大武鄉,,
臺東縣,臺東縣第06選區,10014-06,綠島鄉,,
花蓮縣,花蓮縣第01選區,10015-01,花蓮市,,
花蓮縣,花蓮縣第02選區,10015-02,新城鄉/秀林鄉,,
花蓮縣,花蓮縣第03選區,10015-03,壽豐鄉/光復鄉/豐濱鄉/鳳林鎮/吉安鄉/萬榮鄉,,
花蓮縣,花蓮縣第04選區,10015-04,瑞穗鄉/玉里鎮/富里鄉/卓溪鄉,,
澎湖縣,澎湖縣第01選區,10016-01,馬公市,,
澎湖縣,澎湖縣第02選區,10016-02,湖西鄉,,
澎湖縣,澎湖縣第03選區,10016-03,白沙鄉,,
澎湖縣,澎湖縣第04選區,10016-04,西嶼鄉,,
澎湖縣,澎湖縣第05選區,10016-05,望安鄉,,
澎湖縣,澎湖縣第06選區,10016-06,七美鄉,,
基隆市,基隆市第01選區,10017-01,中正區,,
基隆市,基隆市第02選區,10017-02,信義區,,
基隆市,基隆市第03選區,10017-03,仁愛區,,
基隆市,基隆市第04選區,10017-04,中山區,,
基隆市,基隆市第05選區,10017-05,安樂區,,
基隆市,基隆市第06選區,10017-06,暖暖區,,
基隆市,基隆市第07選區,10017-07,七堵區,,
新竹市,新竹市第01選區,10018-01,東區,,
新竹市,新竹市第02選區,10018-02,東區,,
新竹市,新竹市第03選區,10018-03,北區,,
新竹市,新竹市第04選區,10018-04,北區,,
新竹市,新竹市第05選區,10018-05,香山區,,
嘉義市,嘉義市第01選區,10020-01,東區,,
嘉義市,嘉義市第02選區,10020-02,西區,,
臺北市,臺北市第01選區,63000-01,士林區/北投區,,
臺北市,臺北市第02選區,63000-02,南港區/內湖區,,
臺北市,臺北市第03選區,63000-03,松山區/信義區,,
臺北市,臺北市第04選區,63000-04,中山區/大同區,,
臺北市,臺北市第05選區,63000-05,中正區/萬華區,,
臺北市,臺北市第06選區,63000-06,大安區/文山區,,
高雄市,高雄市第01選區,64000-01,杉林區/美濃區/六龜區/旗山區/甲仙區/內門區/茂林區/桃源區/那瑪夏區,,
高雄市,高雄市第02選區,64000-02,田寮區/阿蓮區/路竹區/湖內區/茄萣區,,
高雄市,高雄市第03選區,64000-03,岡山區/橋頭區/燕巢區/永安區/彌陀區/梓官區,,
高雄市,高雄市第04選區,64000-04,左營區/楠梓區,,
高雄市,高雄市第05選區,64000-05,大樹區/大社區/仁武區/鳥松區,,
高雄市,高雄市第06選區,64000-06,旗津區/鹽埕區/鼓山區,,
高雄市,高雄市第07選區,64000-07,三民區,,
高雄市,高雄市第08選區,64000-08,新興區/前金區/苓雅區,,
高雄市,高雄市第09選區,64000-09,鳳山區,,
高雄市,高雄市第10選區,64000-10,前鎮區/小港區,,
高雄市,高雄市第11選區,64000-11,林園區/大寮區,,
新北市,新北市第01選區,65000-01,淡水區/三芝區/石門區/八里區,,
新北市,新北市第02選區,65000-02,五股區/泰山區/林口區,,
新北市,新北市第03選區,65000-03,新莊區,,
新北市,新北市第04選區,65000-04,三重區/蘆洲區,,
新北市,新北市第05選區,65000-05,板橋區,,
新北市,新北市第06選區,65000-06,中和區,,
新北市,新北市第07選區,65000-07,永和區,,
新北市,新北市第08選區,65000-08,樹林區/鶯歌區/三峽區/土城區,,
新北市,新北市第09選區,65000-09,新店區/深坑區/石碇區/坪林區/烏來區,,
新北市,新北市第10選區,65000-10,瑞芳區/平溪區/雙溪區/貢寮區,,
新北市,新北市第11選區,65000-11,汐止區/金山區/萬里區,,
臺中市,臺中市第01選區,66000-01,大甲區/外埔區/大安區,,
臺中市,臺中市第02選區,66000-02,清水區/沙鹿區/梧棲區,,
臺中市,臺中市第03選區,66000-03,烏日區/大肚區/龍井區,,
臺中市,臺中市第04選區,66000-04,后里區/豐原區,,
臺中市,臺中市第05選區,66000-05,神岡區/潭子區/大雅區,,
臺中市,臺中市第06選區,66000-06,西屯區,,
臺中市,臺中市第07選區,66000-07,南屯區,,
臺中市,臺中市第08選區,66000-08,北屯區,,
臺中市,臺中市第09選區,66000-09,北區,,
臺中市,臺中市第10選區,66000-10,中區/西區,,
臺中市,臺中市第11選區,66000-11,東區/南區,,
臺中市,臺中市第12選區,66000-12,太平區,,
臺中市,臺中市第13選區,66000-13,霧峰區/大里區,,
臺中市,臺中市第14選區,66000-14,東勢區/新社區/石岡區/和平區,,
臺南市,臺南市第01選區,67000-01,鹽水區/白河區/新營區/柳營區/後壁區/東山區,,
臺南市,臺南市第02選區,67000-02,佳里區/學甲區/西港區/七股區/將軍區/北門區,,
臺南市,臺南市第03選區,67000-03,麻豆區/下營區/六甲區/官田區/大內區,,
臺南市,臺南市第04選區,67000-04,玉井區/楠西區/南化區/左鎮區,,
臺南市,臺南市第05選區,67000-05,新化區/善化區/新市區/安定區/山上區,,
臺南市,臺南市第06選區,67000-06,安南區,,
臺南市,臺南市第07選區,67000-07,永康區,,
臺南市,臺南市第08選區,67000-08,北區/中西區,,
臺南市,臺南市第09選區,67000-09,南區/安平區,,
臺南市,臺南市第10選區,67000-10,東區,,
臺南市,臺南市第11選區,67000-11,仁德區/歸仁區/關廟區/龍崎區,,
桃園市,桃園市第01選區,68000-01,桃園區,,
桃園市,桃園市第02選區,68000-02,龜山區,,
桃園市,桃園市第03選區,68000-03,八德區,,
桃園市,桃園市第04選區,68000-04,蘆竹區,,
桃園市,桃園市第05選區,68000-05,大園區,,
桃園市,桃園市第06選區,68000-06,復興區/大溪區,,
桃園市,桃園市第07選區,68000-07,中壢區,,
桃園市,桃園市第08選區,68000-08,平鎮區,,
桃園市,桃園市第09選區,68000-09,楊梅區,,
桃園市,桃園市第10選區,68000-10,龍潭區,,
桃園市,桃園市第11選區,68000-11,新屋區,,
桃園市,桃園市第12選區,68000-12,觀音區,,
